{
  "plan_id": "revision_plan_6a3c67d2-0574-4e0d-ba6a-90f26feffc47",
  "trace_id": "trace_d1c23cf6-5e8f-4f4e-b544-3fad22aefbc2",
  "parent_run_id": "4b587f0b-9ef8-4084-b772-9557181e2b82",
  "status": "needs_input",
  "scope": {
    "slide_ids": [],
    "object_ids": []
  },
  "locked_object_ids": [],
  "locked_slide_ids": [],
  "actions": [],
  "blocked": [
    {
      "issue_id": "issue_0dba1766-4357-4cb1-b50a-1682fae6a83a",
      "severity": "P2",
      "state": "requires_user_input",
      "reason": "Requires grounded replacement/registered assumption or source correction; no automatic fact changes",
      "candidate_id": "candidate_b15c3d6a-fa24-477b-9a4e-f0e74e26e477"
    },
    {
      "issue_id": "issue_e53b80ba-f380-4b3a-8afd-16e4ab3f845c",
      "severity": "P2",
      "state": "requires_user_input",
      "reason": "Requires grounded replacement/registered assumption or source correction; no automatic fact changes",
      "candidate_id": "candidate_73157b2f-3c24-4f83-b278-41a3724d8ddf"
    },
    {
      "issue_id": "issue_d465d4cb-911d-4485-887d-b30d1a47b57e",
      "severity": "P2",
      "state": "requires_user_input",
      "reason": "Requires grounded replacement/registered assumption or source correction; no automatic fact changes",
      "candidate_id": "candidate_603882a2-14a5-4e3f-bc33-28f651ea5332"
    }
  ],
  "candidates": [
    {
      "candidate_id": "candidate_b15c3d6a-fa24-477b-9a4e-f0e74e26e477",
      "issue_id": "issue_0dba1766-4357-4cb1-b50a-1682fae6a83a",
      "object_id": null,
      "slide_id": "slide_04e115ef-ad83-444c-b385-7256a2734f3f",
      "node": "content",
      "state": "requires_user_input",
      "operation": null,
      "changes": {},
      "reason": "Requires grounded replacement/registered assumption or source correction; no automatic fact changes",
      "score": 0,
      "evidence": {
        "issue": {
          "slide_order": 0,
          "severity": "P2",
          "kind": "semantic",
          "detail": "封面页正文直接呈现“制作中文PPT介绍一个虚构校园节能试点”“偏好6页；允许在可读容量不足时按默认软预算分页”等制作指令/元信息，而非面向受众的演示内容，作为封面略显生硬，但不构成事实错误。",
          "evidence_refs": [
            "evidence_ef52af34-f0d0-48df-ab90-3b5f93eefe7f"
          ],
          "issue_id": "issue_0dba1766-4357-4cb1-b50a-1682fae6a83a",
          "slide_id": "slide_04e115ef-ad83-444c-b385-7256a2734f3f",
          "code": "MODEL_SEMANTIC",
          "action": {
            "node": "semantic",
            "mode": "requires_user_input",
            "reason": "Independent review issue needs grounded decision"
          }
        }
      }
    },
    {
      "candidate_id": "candidate_73157b2f-3c24-4f83-b278-41a3724d8ddf",
      "issue_id": "issue_e53b80ba-f380-4b3a-8afd-16e4ab3f845c",
      "object_id": null,
      "slide_id": "slide_b1af26ba-1f76-4a6b-9a7c-2c02a9b7b764",
      "node": "content",
      "state": "requires_user_input",
      "operation": null,
      "changes": {},
      "reason": "Requires grounded replacement/registered assumption or source correction; no automatic fact changes",
      "score": 0,
      "evidence": {
        "issue": {
          "slide_order": 2,
          "severity": "P2",
          "kind": "visual",
          "detail": "表格行高较大、单元格留白偏多，A/B/C三行数据在视觉上被拉得很开，可读性尚可但排版略显松散。",
          "evidence_refs": [
            "evidence_ef52af34-f0d0-48df-ab90-3b5f93eefe7f"
          ],
          "issue_id": "issue_e53b80ba-f380-4b3a-8afd-16e4ab3f845c",
          "slide_id": "slide_b1af26ba-1f76-4a6b-9a7c-2c02a9b7b764",
          "code": "MODEL_SEMANTIC",
          "action": {
            "node": "semantic",
            "mode": "requires_user_input",
            "reason": "Independent review issue needs grounded decision"
          }
        }
      }
    },
    {
      "candidate_id": "candidate_603882a2-14a5-4e3f-bc33-28f651ea5332",
      "issue_id": "issue_d465d4cb-911d-4485-887d-b30d1a47b57e",
      "object_id": null,
      "slide_id": "slide_4f6f5917-ba5e-44f0-b2f7-2894676b40fc",
      "node": "content",
      "state": "requires_user_input",
      "operation": null,
      "changes": {},
      "reason": "Requires grounded replacement/registered assumption or source correction; no automatic fact changes",
      "score": 0,
      "evidence": {
        "issue": {
          "slide_order": 3,
          "severity": "P2",
          "kind": "visual",
          "detail": "柱状图纵轴刻度到120，而数据最大值为100，顶部留白略多；图表本身清晰可读，无裁切或重叠。",
          "evidence_refs": [
            "evidence_ef52af34-f0d0-48df-ab90-3b5f93eefe7f"
          ],
          "issue_id": "issue_d465d4cb-911d-4485-887d-b30d1a47b57e",
          "slide_id": "slide_4f6f5917-ba5e-44f0-b2f7-2894676b40fc",
          "code": "MODEL_SEMANTIC",
          "action": {
            "node": "semantic",
            "mode": "requires_user_input",
            "reason": "Independent review issue needs grounded decision"
          }
        }
      }
    }
  ],
  "all_issue_ids": [
    "issue_0dba1766-4357-4cb1-b50a-1682fae6a83a",
    "issue_e53b80ba-f380-4b3a-8afd-16e4ab3f845c",
    "issue_d465d4cb-911d-4485-887d-b30d1a47b57e"
  ],
  "rerun_nodes": [],
  "preserve_unselected_objects": true,
  "full_acceptance": "not_passed"
}