{
  "plan_id": "revision_plan_a3dc8cff-1a65-443d-8cff-0219b5c05ba2",
  "trace_id": "trace_baabc8e4-6d94-4cdc-93f8-55a3d56df4f6",
  "parent_run_id": "d941e05b-06bf-409a-92ff-a1eddb9569ca",
  "status": "needs_input",
  "scope": {
    "slide_ids": [],
    "object_ids": []
  },
  "locked_object_ids": [],
  "locked_slide_ids": [],
  "actions": [],
  "blocked": [
    {
      "issue_id": "issue_94c279ba-97b5-4598-b0b9-a3966435c3ab",
      "severity": "P1",
      "state": "requires_user_input",
      "reason": "Needs explicit geometry/asset/order choice; related objects must remain unchanged",
      "candidate_id": "candidate_afb0d23f-17ab-4407-99b8-0f430f7529c9"
    },
    {
      "issue_id": "issue_8c75a5f1-9701-47d0-bb6a-6a4d4722fd68",
      "severity": "P1",
      "state": "requires_user_input",
      "reason": "Requires grounded replacement/registered assumption or source correction; no automatic fact changes",
      "candidate_id": "candidate_9ec91c65-cbb8-4339-97a1-0f09314682be"
    },
    {
      "issue_id": "issue_b29fc558-c500-4f0f-b720-691ecfbafe68",
      "severity": "P2",
      "state": "requires_user_input",
      "reason": "Requires grounded replacement/registered assumption or source correction; no automatic fact changes",
      "candidate_id": "candidate_7d2692ef-099c-40a8-8f8e-b12f70a2a7ca"
    },
    {
      "issue_id": "issue_7635329d-a38c-4330-a8a8-18fe51b560fc",
      "severity": "P2",
      "state": "requires_user_input",
      "reason": "Requires grounded replacement/registered assumption or source correction; no automatic fact changes",
      "candidate_id": "candidate_08e54dd9-6cbb-4513-a975-b39299ab11f7"
    }
  ],
  "candidates": [
    {
      "candidate_id": "candidate_afb0d23f-17ab-4407-99b8-0f430f7529c9",
      "issue_id": "issue_94c279ba-97b5-4598-b0b9-a3966435c3ab",
      "object_id": "object_ed4abf06-e682-43ad-bb05-abd7ba940826",
      "slide_id": "slide_ed87186a-ecad-4a1f-93c2-a632193400ab",
      "node": "asset",
      "state": "requires_user_input",
      "operation": null,
      "changes": {},
      "reason": "Needs explicit geometry/asset/order choice; related objects must remain unchanged",
      "score": 0,
      "evidence": {
        "issue": {
          "issue_id": "issue_94c279ba-97b5-4598-b0b9-a3966435c3ab",
          "code": "IMAGE_RESOLUTION_LOW",
          "slide_id": "slide_ed87186a-ecad-4a1f-93c2-a632193400ab",
          "object_id": "object_ed4abf06-e682-43ad-bb05-abd7ba940826",
          "severity": "P1",
          "detail": "Image below rendering policy resolution",
          "requirement_id": "QA-010",
          "measurement": {
            "pixels": [
              320,
              160
            ],
            "effective_dpi": 38.64734299516908
          },
          "threshold": {
            "minimum_dpi": 96
          },
          "action": {
            "node": "asset",
            "mode": "local_revision",
            "reason": "IMAGE_RESOLUTION_LOW"
          }
        }
      }
    },
    {
      "candidate_id": "candidate_9ec91c65-cbb8-4339-97a1-0f09314682be",
      "issue_id": "issue_8c75a5f1-9701-47d0-bb6a-6a4d4722fd68",
      "object_id": null,
      "slide_id": "slide_ed87186a-ecad-4a1f-93c2-a632193400ab",
      "node": "content",
      "state": "requires_user_input",
      "operation": null,
      "changes": {},
      "reason": "Requires grounded replacement/registered assumption or source correction; no automatic fact changes",
      "score": 0,
      "evidence": {
        "issue": {
          "slide_order": 1,
          "severity": "P1",
          "kind": "visual",
          "detail": "图片页的图片区域渲染为纯深绿色色块，未显示任何可辨识的示意图内容；虽然声明为装饰素材，但视觉上无法确认素材内容，且与“程序人工绘制的测试示意图”描述不符，影响页面可读性与素材展示目的。",
          "evidence_refs": [
            "evidence_31d66b61-ee64-4f26-800f-472bd40e1448"
          ],
          "issue_id": "issue_8c75a5f1-9701-47d0-bb6a-6a4d4722fd68",
          "slide_id": "slide_ed87186a-ecad-4a1f-93c2-a632193400ab",
          "code": "MODEL_SEMANTIC",
          "action": {
            "node": "semantic",
            "mode": "requires_user_input",
            "reason": "Independent review issue needs grounded decision"
          }
        }
      }
    },
    {
      "candidate_id": "candidate_7d2692ef-099c-40a8-8f8e-b12f70a2a7ca",
      "issue_id": "issue_b29fc558-c500-4f0f-b720-691ecfbafe68",
      "object_id": null,
      "slide_id": "slide_74faa075-a256-44d9-8dc8-423d323d723f",
      "node": "content",
      "state": "requires_user_input",
      "operation": null,
      "changes": {},
      "reason": "Requires grounded replacement/registered assumption or source correction; no automatic fact changes",
      "score": 0,
      "evidence": {
        "issue": {
          "slide_order": 3,
          "severity": "P2",
          "kind": "visual",
          "detail": "表格行高较大，A楼、B楼、C楼三行之间留白明显，表格整体偏松散，但数值与表头清晰可读，不影响理解。",
          "evidence_refs": [
            "evidence_31d66b61-ee64-4f26-800f-472bd40e1448"
          ],
          "issue_id": "issue_b29fc558-c500-4f0f-b720-691ecfbafe68",
          "slide_id": "slide_74faa075-a256-44d9-8dc8-423d323d723f",
          "code": "MODEL_SEMANTIC",
          "action": {
            "node": "semantic",
            "mode": "requires_user_input",
            "reason": "Independent review issue needs grounded decision"
          }
        }
      }
    },
    {
      "candidate_id": "candidate_08e54dd9-6cbb-4513-a975-b39299ab11f7",
      "issue_id": "issue_7635329d-a38c-4330-a8a8-18fe51b560fc",
      "object_id": null,
      "slide_id": "slide_7b0e971b-2ffc-45f6-bc6b-825aa688c510",
      "node": "content",
      "state": "requires_user_input",
      "operation": null,
      "changes": {},
      "reason": "Requires grounded replacement/registered assumption or source correction; no automatic fact changes",
      "score": 0,
      "evidence": {
        "issue": {
          "slide_order": 4,
          "severity": "P2",
          "kind": "visual",
          "detail": "柱图图例顺序为“本期、基线”，与标题“基线与本期”及左侧正文“基线与本期”的叙述顺序相反；同时柱体排列为每组先本期后基线，与标题顺序不一致。虽不影响数值读取，但顺序不统一可能造成轻微阅读混淆。",
          "evidence_refs": [
            "evidence_31d66b61-ee64-4f26-800f-472bd40e1448"
          ],
          "issue_id": "issue_7635329d-a38c-4330-a8a8-18fe51b560fc",
          "slide_id": "slide_7b0e971b-2ffc-45f6-bc6b-825aa688c510",
          "code": "MODEL_SEMANTIC",
          "action": {
            "node": "semantic",
            "mode": "requires_user_input",
            "reason": "Independent review issue needs grounded decision"
          }
        }
      }
    }
  ],
  "all_issue_ids": [
    "issue_94c279ba-97b5-4598-b0b9-a3966435c3ab",
    "issue_8c75a5f1-9701-47d0-bb6a-6a4d4722fd68",
    "issue_b29fc558-c500-4f0f-b720-691ecfbafe68",
    "issue_7635329d-a38c-4330-a8a8-18fe51b560fc"
  ],
  "rerun_nodes": [],
  "preserve_unselected_objects": true,
  "full_acceptance": "not_passed"
}