{
  "plan_id": "revision_plan_56b639f1-75da-4569-9358-f9a2b1cef04f",
  "trace_id": "trace_e71a8a34-cbb8-47d5-9624-181e91033e45",
  "parent_run_id": "39a2dbf3-c19b-4da2-99a6-27fe7b82ef7a",
  "status": "needs_input",
  "scope": {
    "slide_ids": [],
    "object_ids": []
  },
  "locked_object_ids": [],
  "locked_slide_ids": [],
  "actions": [],
  "blocked": [
    {
      "issue_id": "issue_a2ed68da-e2de-4b4c-b8a7-6b3fabe2954b",
      "severity": "P1",
      "state": "requires_user_input",
      "reason": "Needs explicit geometry/asset/order choice; related objects must remain unchanged",
      "candidate_id": "candidate_001554c5-8f28-4286-b45a-8f35090f8936"
    },
    {
      "issue_id": "issue_8c75a5f1-9701-47d0-bb6a-6a4d4722fd68",
      "severity": "P1",
      "state": "requires_user_input",
      "reason": "Requires grounded replacement/registered assumption or source correction; no automatic fact changes",
      "candidate_id": "candidate_aea1a81b-08b2-4d92-8d66-df76ad592e91"
    },
    {
      "issue_id": "issue_b29fc558-c500-4f0f-b720-691ecfbafe68",
      "severity": "P2",
      "state": "requires_user_input",
      "reason": "Requires grounded replacement/registered assumption or source correction; no automatic fact changes",
      "candidate_id": "candidate_21efdf5d-a81c-40f2-abca-a3f69744f56a"
    },
    {
      "issue_id": "issue_a36e2186-5bb2-43b1-bfc1-6fbf78e09b55",
      "severity": "P2",
      "state": "requires_user_input",
      "reason": "Requires grounded replacement/registered assumption or source correction; no automatic fact changes",
      "candidate_id": "candidate_ed75739c-a01e-457d-b897-3098edf099d7"
    }
  ],
  "candidates": [
    {
      "candidate_id": "candidate_001554c5-8f28-4286-b45a-8f35090f8936",
      "issue_id": "issue_a2ed68da-e2de-4b4c-b8a7-6b3fabe2954b",
      "object_id": "object_ed4abf06-e682-43ad-bb05-abd7ba940826",
      "slide_id": "slide_ed87186a-ecad-4a1f-93c2-a632193400ab",
      "node": "asset",
      "state": "requires_user_input",
      "operation": null,
      "changes": {},
      "reason": "Needs explicit geometry/asset/order choice; related objects must remain unchanged",
      "score": 0,
      "evidence": {
        "issue": {
          "issue_id": "issue_a2ed68da-e2de-4b4c-b8a7-6b3fabe2954b",
          "code": "IMAGE_RESOLUTION_LOW",
          "slide_id": "slide_ed87186a-ecad-4a1f-93c2-a632193400ab",
          "object_id": "object_ed4abf06-e682-43ad-bb05-abd7ba940826",
          "severity": "P1",
          "detail": "Image below rendering policy resolution",
          "requirement_id": "QA-010",
          "measurement": {
            "pixels": [
              320,
              160
            ],
            "effective_dpi": 38.64734299516908
          },
          "threshold": {
            "minimum_dpi": 96
          },
          "action": {
            "node": "asset",
            "mode": "local_revision",
            "reason": "IMAGE_RESOLUTION_LOW"
          }
        }
      }
    },
    {
      "candidate_id": "candidate_aea1a81b-08b2-4d92-8d66-df76ad592e91",
      "issue_id": "issue_8c75a5f1-9701-47d0-bb6a-6a4d4722fd68",
      "object_id": null,
      "slide_id": "slide_ed87186a-ecad-4a1f-93c2-a632193400ab",
      "node": "content",
      "state": "requires_user_input",
      "operation": null,
      "changes": {},
      "reason": "Requires grounded replacement/registered assumption or source correction; no automatic fact changes",
      "score": 0,
      "evidence": {
        "issue": {
          "slide_order": 1,
          "severity": "P1",
          "kind": "visual",
          "detail": "图片页的图片区域渲染为纯深绿色色块，未显示任何可辨识的示意图内容；虽然声明为装饰素材，但视觉上无法确认素材内容，且与“程序人工绘制的测试示意图”描述不符，影响页面可读性与素材展示目的。",
          "evidence_refs": [
            "evidence_31d66b61-ee64-4f26-800f-472bd40e1448"
          ],
          "issue_id": "issue_8c75a5f1-9701-47d0-bb6a-6a4d4722fd68",
          "slide_id": "slide_ed87186a-ecad-4a1f-93c2-a632193400ab",
          "code": "MODEL_SEMANTIC",
          "action": {
            "node": "semantic",
            "mode": "requires_user_input",
            "reason": "Independent review issue needs grounded decision"
          }
        }
      }
    },
    {
      "candidate_id": "candidate_21efdf5d-a81c-40f2-abca-a3f69744f56a",
      "issue_id": "issue_b29fc558-c500-4f0f-b720-691ecfbafe68",
      "object_id": null,
      "slide_id": "slide_74faa075-a256-44d9-8dc8-423d323d723f",
      "node": "content",
      "state": "requires_user_input",
      "operation": null,
      "changes": {},
      "reason": "Requires grounded replacement/registered assumption or source correction; no automatic fact changes",
      "score": 0,
      "evidence": {
        "issue": {
          "slide_order": 3,
          "severity": "P2",
          "kind": "visual",
          "detail": "表格行高较大，A楼、B楼、C楼三行之间留白明显，表格整体偏松散，但数值与表头清晰可读，不影响理解。",
          "evidence_refs": [
            "evidence_31d66b61-ee64-4f26-800f-472bd40e1448"
          ],
          "issue_id": "issue_b29fc558-c500-4f0f-b720-691ecfbafe68",
          "slide_id": "slide_74faa075-a256-44d9-8dc8-423d323d723f",
          "code": "MODEL_SEMANTIC",
          "action": {
            "node": "semantic",
            "mode": "requires_user_input",
            "reason": "Independent review issue needs grounded decision"
          }
        }
      }
    },
    {
      "candidate_id": "candidate_ed75739c-a01e-457d-b897-3098edf099d7",
      "issue_id": "issue_a36e2186-5bb2-43b1-bfc1-6fbf78e09b55",
      "object_id": null,
      "slide_id": "slide_7b0e971b-2ffc-45f6-bc6b-825aa688c510",
      "node": "content",
      "state": "requires_user_input",
      "operation": null,
      "changes": {},
      "reason": "Requires grounded replacement/registered assumption or source correction; no automatic fact changes",
      "score": 0,
      "evidence": {
        "issue": {
          "slide_order": 4,
          "severity": "P2",
          "kind": "visual",
          "detail": "柱图纵轴标签“千瓦时”为竖排文字，与图表整体横向布局略不协调，但数值刻度与图例清晰，不影响数据读取。",
          "evidence_refs": [
            "evidence_31d66b61-ee64-4f26-800f-472bd40e1448"
          ],
          "issue_id": "issue_a36e2186-5bb2-43b1-bfc1-6fbf78e09b55",
          "slide_id": "slide_7b0e971b-2ffc-45f6-bc6b-825aa688c510",
          "code": "MODEL_SEMANTIC",
          "action": {
            "node": "semantic",
            "mode": "requires_user_input",
            "reason": "Independent review issue needs grounded decision"
          }
        }
      }
    }
  ],
  "all_issue_ids": [
    "issue_a2ed68da-e2de-4b4c-b8a7-6b3fabe2954b",
    "issue_8c75a5f1-9701-47d0-bb6a-6a4d4722fd68",
    "issue_b29fc558-c500-4f0f-b720-691ecfbafe68",
    "issue_a36e2186-5bb2-43b1-bfc1-6fbf78e09b55"
  ],
  "rerun_nodes": [],
  "preserve_unselected_objects": true,
  "full_acceptance": "not_passed"
}